file_name,drawing_title,drawing_number,revision,latest_revision,latest_date,latest_reason,table_title,status
L01-H01D01-FOS-00-XX-MUP-AR-80050[T0].pdf,Ring-R162 EWS-551/ DRS-103 Typical MEP Door Plan Detail,L01-H01D01-FOS-00-XX-MUP-AR-80050,T0,,,,13/10/2023CONSTRUCTION PROCUREMENT,SUCCESS
L01-H01D02-WSP-75-XX-MUP-IC-80301[T1].pdf,Double Queen Bedroom Bathroom Entry Entry,L01-H01D02-WSP-75-XX-MUP-IC-80301,T1,T1,07/11/2024,ISSUED FOR TENDER,CONSTRUCTION PROCUREMENT,SUCCESS
L01-O01C01-AIC-XX-XX-ABD-ST-10031[AA] - Sample of AS-BUILT Drawing.pdf,AAAs Built Shoring Bottom Layout,L01-O01C01-AIC-XX-XX-ABD-ST-10031,AA,,,,,SUCCESS
L02-R02D01-FOS-00-XX-DWG-AR-00001[07].pdf,topography and villa location on the masterplan.,L02-R02D01-FOS-00-XX-DWG-AR-00001,07,,,,Not for Construction.,SUCCESS
L02-R02DXX-RSG-00-ZZ-SKT-LS-12801[N0] - Sample Sketch.pdf,LS-5180204•VILLAS WHICH INCLUDE THIS POOL VESSEL,L02-R02DXX-RSG-00-ZZ-SKT-LS-12801,N0,N0,31/07/25,Issued For Construction RSGBS,31/07/25Construction Procurement,SUCCESS
L02-R02DXX-RSG-BN-ZZ-SKT-LS-11435[N0] - Sample Sketch.pdf,CONSUMED BACKGROUNDS.  REFER TO COORDINATION TRACKER FOR DETAILS.,L02-R02DXX-RSG-BN-ZZ-SKT-LS-11435,N0,N0,31/07/25,Issued For Construction RSG,Construction Procu rement,SUCCESS
L04-A04D02-CHP-16-00-DWG-SP-10001[N0].pdf,FRAME & GRATE LEGEND QTY POOL FITTINGS FOR SWIMMING POOL,L04-A04D02-CHP-16-00-DWG-SP-10001,N0,N0,13/08/25,ISSUED FOR CONSTRUCTION AR,CONSTRUCTION PURPOSES.,SUCCESS
